<?xml version="1.0" encoding="UTF-8"?>
<xsd:schema xmlns:xsd="http://www.w3.org/2001/XMLSchema" >
<xsd:element name="Erxl">
<xsd:complexType>
<xsd:sequence>
<xsd:element ref="Loc" minOccurs="0" maxOccurs="unbounded"/>
</xsd:sequence>
<xsd:attribute name="version" use="required"><xsd:simpleType><xsd:restriction base="xsd:string"><xsd:pattern value="[1-9][0-9]*([\.][1-9][0-9]*)*"/></xsd:restriction></xsd:simpleType></xsd:attribute>
</xsd:complexType>
</xsd:element>
<xsd:element name="Loc">
<xsd:annotation>
<xsd:appinfo/>
</xsd:annotation>
<xsd:complexType>
<xsd:sequence>
<xsd:element name="Family" minOccurs="0">
<xsd:simpleType>
<xsd:restriction base="xsd:string">
</xsd:restriction>
</xsd:simpleType>
</xsd:element>
<xsd:element name="Version" minOccurs="0">
<xsd:simpleType>
<xsd:restriction base="xsd:string">
</xsd:restriction>
</xsd:simpleType>
</xsd:element>
<xsd:element name="Href" minOccurs="0">
<xsd:simpleType>
<xsd:restriction base="xsd:string">
</xsd:restriction>
</xsd:simpleType>
</xsd:element>
<xsd:element name="LocalHref" minOccurs="0">
<xsd:simpleType>
<xsd:restriction base="xsd:string">
</xsd:restriction>
</xsd:simpleType>
</xsd:element>
<xsd:element name="AttType" minOccurs="0">
<xsd:simpleType>
<xsd:restriction base="xsd:string">
</xsd:restriction>
</xsd:simpleType>
</xsd:element>
<xsd:element name="FileTypeName" minOccurs="0">
<xsd:simpleType>
<xsd:restriction base="xsd:string">
</xsd:restriction>
</xsd:simpleType>
</xsd:element>
<xsd:element name="Elements" minOccurs="1"/>
<xsd:element name="Namespace" minOccurs="0">
<xsd:simpleType>
<xsd:restriction base="xsd:string">
</xsd:restriction>
</xsd:simpleType>
</xsd:element>
<xsd:element name="Prefix" minOccurs="0">
<xsd:simpleType>
<xsd:restriction base="xsd:string">
</xsd:restriction>
</xsd:simpleType>
</xsd:element>
</xsd:sequence>
</xsd:complexType>
</xsd:element>
</xsd:schema>
