<?xml version="1.0" encoding="UTF-8"?>
<Erxl xmlns:xsi="http://www.w3.org/2001/XMLSchema-instance" 
      xmlns:xi="http://www.w3.org/2001/XInclude"
      xsi:noNamespaceSchemaLocation="../../../config/erxl.xsd" 
      version="34">
  <Loc><Family>IFRS</Family><Version>2013</Version><Href>http://xbrl.ifrs.org/taxonomy/2013-09-09/ifrs-cor_2013-09-09.xsd</Href><AttType>SCH</AttType><FileTypeName>Schema</FileTypeName><Elements>1</Elements><Namespace>http://xbrl.ifrs.org/taxonomy/2013-09-09/ifrs</Namespace><Prefix>currency</Prefix></Loc>
  <Loc><Family>IFRS</Family><Version>2014</Version><Href>http://xbrl.ifrs.org/taxonomy/2014-03-05/full_ifrs/full_ifrs-cor_2014-03-05.xsd</Href><AttType>SCH</AttType><FileTypeName>Schema</FileTypeName><Elements>1</Elements><Namespace>http://xbrl.ifrs.org/taxonomy/2014-03-05/ifrs-full</Namespace><Prefix>currency</Prefix></Loc>
  <Loc><Family>IFRS</Family><Version>2014</Version><Href>http://xbrl.ifrs.org/taxonomy/2014-03-05/ifrs_for_smes/ifrs_for_smes-cor_2014-03-05.xsd</Href><AttType>SCH</AttType><FileTypeName>Schema</FileTypeName><Elements>1</Elements><Namespace>http://xbrl.ifrs.org/taxonomy/2014-03-05/ifrs-smes</Namespace><Prefix>currency</Prefix></Loc>
  <Loc><Family>IFRS</Family><Version>2015</Version><Href>http://xbrl.ifrs.org/taxonomy/2015-03-11/full_ifrs/full_ifrs-cor_2015-03-11.xsd</Href><AttType>SCH</AttType><FileTypeName>Schema</FileTypeName><Elements>1</Elements><Namespace>http://xbrl.ifrs.org/taxonomy/2015-03-11/ifrs-full</Namespace><Prefix>ifrs</Prefix></Loc>
  <Loc><Family>IFRS</Family><Version>2016</Version><Href>http://xbrl.ifrs.org/taxonomy/2016-03-31/full_ifrs/full_ifrs-cor_2016-03-31.xsd</Href><AttType>SCH</AttType><FileTypeName>Schema</FileTypeName><Elements>1</Elements><Namespace>http://xbrl.ifrs.org/taxonomy/2016-03-31/ifrs-full</Namespace><Prefix>ifrs</Prefix></Loc>
  <Loc><Family>IFRS</Family><Version>2016.2</Version><Href>http://xbrl.ifrs.org/taxonomy/2016-09-12/full_ifrs/full_ifrs-cor_2016-09-12.xsd</Href><AttType>SCH</AttType><FileTypeName>Schema</FileTypeName><Elements>1</Elements><Namespace>http://xbrl.ifrs.org/taxonomy/2016-09-12/ifrs-full</Namespace><Prefix>ifrs</Prefix></Loc>
	<Loc>
		<Family>IFRS</Family>
		<Version>2021</Version>
		<Href>https://xbrl.sec.gov/dei/2021/dei-2021.xsd</Href>
		<AttType>SCH</AttType>
		<FileTypeName>Schema</FileTypeName>
		<Elements>1</Elements>
		<Namespace>http://xbrl.sec.gov/dei/2021</Namespace>
		<Prefix>dei</Prefix>
	</Loc>
</Erxl>