<?xml version="1.0" encoding="UTF-8"?>
<Erxl xmlns:xsi="http://www.w3.org/2001/XMLSchema-instance" 
      xmlns:xi="http://www.w3.org/2001/XInclude"
      xsi:noNamespaceSchemaLocation="../../../config/erxl.xsd" 
      version="34">
  <!-- SEC EDGAR taxonomies -->
  <xi:include href="edgartaxonomies-all-years.xml" xpointer="xpointer(/*/*)" />
  
  <!-- IFRS taxonomies added by Arelle 
       required standard taxonomy for US preparers doing 20F/40F conformant to EFM
       not for submission to EDGAR -->
  <xi:include href="ifrstaxonomies-all-years.xml" xpointer="xpointer(/*/*)" />

  <!-- Arelle taxonomy for cover documents
       required standard taxonomy by database loader
       (generated by Arelle, not for submission to EDGAR) -->
  <Loc><Family>Arelle</Family><Version>2014</Version><Href>http://arelle.org/2014/doc-2014-01-31.xsd</Href><AttType>SCH</AttType><FileTypeName>Schema</FileTypeName><Elements>1</Elements><Namespace>http://arelle.org/doc/2014-01-31</Namespace><Prefix>doc</Prefix></Loc>
</Erxl>